<?xml version="1.0" encoding="UTF-8"?>
<tns:topology xmlns:tns="http://petals.ow2.org/topology"
	xmlns:xsi="http://www.w3.org/2001/XMLSchema-instance"
	xsi:schemaLocation="http://petals.ow2.org/topology petalsTopology.xsd">
	<tns:domain mode="standalone" name="PEtALS">
	<tns:description>standalone topology</tns:description>
		<!-- the internal jndi server is used by default
			<tns:jndi>
			<tns:factory>org.ow2.petals.communication.jndi.client.naming.NamingContextFactory</tns:factory>
			<tns:host>host</tns:host>
			<tns:port>0</tns:port>
			</tns:jndi>
		-->
		<tns:sub-domain name="subdomain1" mode="standalone">
			<tns:container name="0" type="standalone">
				<tns:host>localhost</tns:host>
				<tns:description>description of the features of the Standalone container</tns:description>
				<tns:user>petals</tns:user>
				<tns:password>petals</tns:password>
				<tns:webservice-service>
					<tns:port>7600</tns:port>
					<tns:prefix>petals/ws</tns:prefix>
				</tns:webservice-service>
				<tns:jmx-service>
					<tns:rmi-port>7700</tns:rmi-port>
				</tns:jmx-service>
				<tns:registry-service>
					<tns:port>7900</tns:port>
				</tns:registry-service>
			</tns:container>
		</tns:sub-domain>
	</tns:domain>
</tns:topology>
